id,url,price,currency,status,brokerName,beds,baths,fullAddress,city,state,street,zipcode,latitude,longitude,image,photos,zestimate,rentZestimate,trueStatus,contingentListingType,daysOnZillow,parcelNumber,brokerPhoneNumber,agentName,agentPhoneNumber,agentEmail,agentOtherEmails,homeType,yearBuilt,area,lotArea,lotAreaUnits,description,schools,priceHistory
30758891,https://www.zillow.com/homedetails/1172-E-46th-St-Brooklyn-NY-11234/30758891_zpid/,705000,USD,FOR_SALE,Talk of the Town Realty,3,2,1172 E 46th St,Brooklyn,NY,1172 E 46th St,11234,40.63233,-73.9325,https://photos.zillowstatic.com/fp/8b412bf752a7ec02a54d9bb7402c5512-p_h.jpg,"https://photos.zillowstatic.com/fp/8b412bf752a7ec02a54d9bb7402c5512-uncropped_scaled_within_1536_1152.jpg, https://photos.zillowstatic.com/fp/876c0d251bbf2172cfb676d9c41b365b-uncropped_scaled_within_1536_1152.jpg, https://photos.zillowstatic.com/fp/ccf9b4d5141613c5afe594665fe96965-uncropped_scaled_within_1536_1152.jpg, https://photos.zillowstatic.com/fp/ce48bf3b67324d30fdbff90e2db7ac49-uncropped_scaled_within_1536_1152.jpg, https://photos.zillowstatic.com/fp/5567a322005bfc302bb123713d570438-uncropped_scaled_within_1536_1152.jpg, https://photos.zillowstatic.com/fp/b70fc981bec8b5ce12f9583e135e1eee-uncropped_scaled_within_1536_1152.jpg, https://photos.zillowstatic.com/fp/ee8f0d270ffd4936355a9fe71525ee6d-uncropped_scaled_within_1536_1152.jpg, https://photos.zillowstatic.com/fp/de164a8780151a0d1436367f34194d0c-uncropped_scaled_within_1536_1152.jpg, https://photos.zillowstatic.com/fp/d4c5e5f618414cb8390d7ca86334695e-uncropped_scaled_within_1536_1152.jpg, https://photos.zillowstatic.com/fp/d9979192d3bdef5be69cfdbeca40adeb-uncropped_scaled_within_1536_1152.jpg, https://photos.zillowstatic.com/fp/c4c637d9b5a444bef4f7e61284b26700-uncropped_scaled_within_1536_1152.jpg, https://photos.zillowstatic.com/fp/d92bbe2c858ad61f9093c53de3652c0d-uncropped_scaled_within_1536_1152.jpg, https://photos.zillowstatic.com/fp/e1e0f48b3b742fd355a6b5beff38e643-uncropped_scaled_within_1536_1152.jpg, https://photos.zillowstatic.com/fp/77f9775a97d3768e4b7d59f0f11788dc-uncropped_scaled_within_1536_1152.jpg, https://photos.zillowstatic.com/fp/c2e598b2392437b78c6cb2e9dd11bf5d-uncropped_scaled_within_1536_1152.jpg, https://photos.zillowstatic.com/fp/c03a9f6b3a28ebfc11da10aa3910423c-uncropped_scaled_within_1536_1152.jpg, https://photos.zillowstatic.com/fp/eb76d541e4038db6c248837298f423ef-uncropped_scaled_within_1536_1152.jpg, https://photos.zillowstatic.com/fp/3d8af39810f5cc2e2eb80626568a731f-uncropped_scaled_within_1536_1152.jpg, https://photos.zillowstatic.com/fp/00a62dca18e9f095aba7e9e5d888d411-uncropped_scaled_within_1536_1152.jpg",,4080,Active,,15,077490048,917-776-5501,Keren Shalmoni,917-776-5501,kerens@talktownre.com,,SINGLE_FAMILY,1940,2120,,sqft,"EAST FLATBUSH- ALL BRICK HOME-Great quiet location. This lovely single family home is designed keeping comfort in mind. Beautiful front tiled porch,  nice entry foyer with a coat closet, main level has a great floor plan holding a large eat in kitchen with plenty of storage, extra large living room & dining room combination with 10 feet ceiling height, a renovated
full bathroom with a tub and shower, 2 large bedrooms with access to a beautiful backyard. The walk in level has a summer kitchen, a great family room with a living room, a  large bedroom and a full bathroom, Laundry & boiler room, both floors have access to the backyard. This comfortable home also has a separate front entrance from the walk in level, making it a perfect fit for any lifestyle choice.  Perfect set up for someone needing a home office or just extra space for family. There's also a private driveway & garage. This is the perfect place to call HOME. call today don't miss out.",,
455451167,https://www.zillow.com/homedetails/1346-E-65th-St-1-Brooklyn-NY-11234/455451167_zpid/,779000,USD,FOR_SALE,"Elite Home Sales, Inc.",3,2,1346 E 65th St #1,Brooklyn,NY,1346 E 65th St #1,11234,40.62085,-73.916275,https://photos.zillowstatic.com/fp/e4fb058ee49e6cbedccc166498074fe0-p_h.jpg,"https://photos.zillowstatic.com/fp/e4fb058ee49e6cbedccc166498074fe0-uncropped_scaled_within_1536_1152.jpg, https://photos.zillowstatic.com/fp/e66de91b0fa72df0b66365895e0d0ffd-uncropped_scaled_within_1536_1152.jpg, https://photos.zillowstatic.com/fp/7ada57a7d7cc419120be69579df924a6-uncropped_scaled_within_1536_1152.jpg, https://photos.zillowstatic.com/fp/78428dd3f5ea1e919e9c7c520875b64e-uncropped_scaled_within_1536_1152.jpg, https://photos.zillowstatic.com/fp/e38d0c198ce716163b8ed305fd4b3cb3-uncropped_scaled_within_1536_1152.jpg, https://photos.zillowstatic.com/fp/a9d000379446b1f532a117f82b756fd0-uncropped_scaled_within_1536_1152.jpg, https://photos.zillowstatic.com/fp/ab92de3d4bab1211123508ac087a6bf2-uncropped_scaled_within_1536_1152.jpg, https://photos.zillowstatic.com/fp/c380404482149bdb90e7f979b5b08df9-uncropped_scaled_within_1536_1152.jpg, https://photos.zillowstatic.com/fp/bf2a84087588642fc38c0df71780d4d6-uncropped_scaled_within_1536_1152.jpg, https://photos.zillowstatic.com/fp/97969412429607ceb70a1ead91b12024-uncropped_scaled_within_1536_1152.jpg, https://photos.zillowstatic.com/fp/10ad38faf64733e9e40a4c74c8fae87d-uncropped_scaled_within_1536_1152.jpg, https://photos.zillowstatic.com/fp/40f556fb3bb58d639a189a42cf3dfd1f-uncropped_scaled_within_1536_1152.jpg",774900,,Active,,15,,718-375-6200,Edward Weigert,718-375-6200,,,SINGLE_FAMILY,1925,1296,,sqft,"You asked and here it is! Beautiful Semi Detached 1 family gem on super block. This home is perfect for your family. Featuring 3 spacious bedroom, modern bath and more. Open concept living room, formal dining rood and kitchen. Hardwood floors, large finished basement for quiet family time. Nice yard and off street parking.  Photos from prior offering may differ.",,
30740370,https://www.zillow.com/homedetails/2635-Hubbard-St-Brooklyn-NY-11235/30740370_zpid/,749000,USD,FOR_SALE,JACOB GOLD REALTY INC,3,2,2635 Hubbard St,Brooklyn,NY,2635 Hubbard St,11235,40.58617,-73.96256,https://photos.zillowstatic.com/fp/fa3efe7692bf1047ffb0032a1e8ff8e0-p_h.jpg,"https://photos.zillowstatic.com/fp/fa3efe7692bf1047ffb0032a1e8ff8e0-uncropped_scaled_within_1536_1152.jpg, https://photos.zillowstatic.com/fp/84990d8bf21ae9319877f2a286d1de37-uncropped_scaled_within_1536_1152.jpg, https://photos.zillowstatic.com/fp/0b5fc3718b532325ef9a2d2aae0b405a-uncropped_scaled_within_1536_1152.jpg",738500,4088,,,16,072430169,718-753-1713,Jacob Gold,718-753-1713,ethelgold53@yahoo.com,,SINGLE_FAMILY,0,1604,1600,Square Feet,"Gravesend - 1 family attached brick tri-plex - 3 bedrooms 2 baths - Lot Size 16X100 1,600 sq ft - RE Taxes $6,213 - built 1930 - near all - convenient to all shopping transportation schools etc - As Is condition - needs total renovation - priced too sell!!! All Sales Subject to Court Approval",,
143026387,https://www.zillow.com/homedetails/993-E-39th-St-Brooklyn-NY-11210/143026387_zpid/,749000,USD,FOR_SALE,Remax Edge,3,2,993 E 39th St,Brooklyn,NY,993 E 39th St,11210,40.632717,-73.93869,https://photos.zillowstatic.com/fp/baaea1ca18e976200f46aee8579f725b-p_h.jpg,"https://photos.zillowstatic.com/fp/baaea1ca18e976200f46aee8579f725b-uncropped_scaled_within_1536_1152.jpg, https://photos.zillowstatic.com/fp/d1cc124dea3208893dc799666c34b783-uncropped_scaled_within_1536_1152.jpg, https://photos.zillowstatic.com/fp/e2c6a24b18d1ea130029715bb076c39d-uncropped_scaled_within_1536_1152.jpg, https://photos.zillowstatic.com/fp/4fcbbb3553c3fea11d1d4df56d7020d6-uncropped_scaled_within_1536_1152.jpg, https://photos.zillowstatic.com/fp/1848e3d07da818b2b3c710cc1ced04b3-uncropped_scaled_within_1536_1152.jpg, https://photos.zillowstatic.com/fp/ca67167b7ed26ab77ed52037c9945130-uncropped_scaled_within_1536_1152.jpg, https://photos.zillowstatic.com/fp/354a42ddb853d021dea405a9e027fedb-uncropped_scaled_within_1536_1152.jpg, https://photos.zillowstatic.com/fp/6589e3cb718f02b95c272be07b0a5ac6-uncropped_scaled_within_1536_1152.jpg, https://photos.zillowstatic.com/fp/e0fdaa224b480754ade66063ce2a26c3-uncropped_scaled_within_1536_1152.jpg, https://photos.zillowstatic.com/fp/0af58f01a423c9bfb10b5775c2ff88e9-uncropped_scaled_within_1536_1152.jpg, https://photos.zillowstatic.com/fp/c6f7592703d0c05958cc6c305300f9ca-uncropped_scaled_within_1536_1152.jpg, https://photos.zillowstatic.com/fp/f4f183a4abd6c49f49e96890ce4a1d04-uncropped_scaled_within_1536_1152.jpg, https://photos.zillowstatic.com/fp/95164bbe571f11fafc43282fa8e859c2-uncropped_scaled_within_1536_1152.jpg, https://photos.zillowstatic.com/fp/72f0441a9dc048ca5e3400e00cc95816-uncropped_scaled_within_1536_1152.jpg, https://photos.zillowstatic.com/fp/0105e6f8470c20b90919e511126aa7eb-uncropped_scaled_within_1536_1152.jpg, https://photos.zillowstatic.com/fp/63a3535c317a1f4f3608dc903f70373f-uncropped_scaled_within_1536_1152.jpg, https://photos.zillowstatic.com/fp/b5be6369b4935010363bf164b2393f32-uncropped_scaled_within_1536_1152.jpg, https://photos.zillowstatic.com/fp/20db480381734d8792b4f58d3298ef90-uncropped_scaled_within_1536_1152.jpg, https://photos.zillowstatic.com/fp/2fc9644c5fb20d965cf2a2c86b4829e6-uncropped_scaled_within_1536_1152.jpg, https://photos.zillowstatic.com/fp/0e47ed3ec2b4c06dd5414028a96a3ddf-uncropped_scaled_within_1536_1152.jpg",,4823,Active,,16,07723000701,917-533-0644,Nicholas Orlando,917-533-0644,,,SINGLE_FAMILY,1925,1472,,sqft,"Located on a quiet, tree-lined block at the East Flatbush/Midwood border, 993 E 39th Street is a light-filled, detached single-family home offering comfort, space, and versatility. Set on an expansive 30 x 100 lot, this 3-bedroom, 2-bathroom residence features a flexible layout, generous interior proportions, and outstanding potential—all just minutes from the vibrant Flatbush-Nostrand Junction. 

The main level features a spacious living room, formal dining room, and a galley kitchen featuring an abundance of cabinets, backyard views, and direct access to the outdoor space—perfect for easy indoor-outdoor living. Upstairs, you'll find 3 well-proportioned bedrooms and a full bathroom. 

The full walk-up attic provides outstanding storage and the opportunity to expand your living space. A side entrance leads to a semi-finished basement with four bonus rooms and a second full bathroom—ideal for guest accommodations, recreation, or home office use. 

Outside, a beautifully landscaped yard with a new PVC fence offers a peaceful retreat, ideal for entertaining or gardening. Additional highlights include a shared driveway and detached garage. 

Conveniently located just 4-minutes from Flatbush and Nostrand Avenues, the home is surrounded by shopping, dining, Target, banks, and essential services. 

Brooklyn College is only 7-minutes away, and SUNY Downstate, Kings County Hospital, and Maimonides Midwood Community Hospital are all within a 15-minute drive. Nearby attractions include Prospect Park, Kings Theatre, and a variety of neighborhood cafés and cultural venues. 

For commuters, the 2 and 5 subway lines are easily accessible, along with multiple local bus routes including the B41, B103, B6, Q35, B11, B7, and B44, offering direct connections to Downtown Brooklyn, Kings Plaza, Rockaway Park, Williamsburg, Sheepshead Bay, and more. This is a rare opportunity to own a spacious and adaptable home on a full-sized Brooklyn lot.",,
30648880,https://www.zillow.com/homedetails/971-Schenck-Ave-Brooklyn-NY-11207/30648880_zpid/,580000,USD,FOR_SALE,Brooklyn Real Property Inc,2,2,971 Schenck Ave,Brooklyn,NY,971 Schenck Ave,11207,40.656776,-73.88031,https://photos.zillowstatic.com/fp/7660bce6407d7647ede34ddd86209852-p_h.jpg,"https://photos.zillowstatic.com/fp/7660bce6407d7647ede34ddd86209852-uncropped_scaled_within_1536_1152.jpg, https://photos.zillowstatic.com/fp/ede91e88000672214fb1fba755161c61-uncropped_scaled_within_1536_1152.jpg, https://photos.zillowstatic.com/fp/99b3cfe3acf9c2481b045974c59f633f-uncropped_scaled_within_1536_1152.jpg, https://photos.zillowstatic.com/fp/fc80db31a5d2a03329bba115fa5e393a-uncropped_scaled_within_1536_1152.jpg, https://photos.zillowstatic.com/fp/3209fbca7c18141f029fc169351847bd-uncropped_scaled_within_1536_1152.jpg, https://photos.zillowstatic.com/fp/a6f6b4916aa15151efb02831f6ea039c-uncropped_scaled_within_1536_1152.jpg",598700,3502,Active,,19,044210054,347-243-6930,Kimberly Guzman,347-243-6930,kimberlyguzman@bklynrp.com,,SINGLE_FAMILY,1960,1088,,sqft,"Take a look at this great opportunity in East New York, Brooklyn – perfect for homeowners or investors! This single-family duplex features a private backyard and a fully finished basement. The first floor includes a spacious eat-in kitchen, dining room, half bathroom, and a bright, open living room – perfect for entertaining or relaxing. Upper level, you’ll find two generous bedrooms, a walk-in closet, and a full bathroom. The second floor also features a brand-new skylight that fills the space with natural light and adds a warm, inviting touch. The finished basement provides extra space and opens directly to the private backyard – ideal for outdoor gatherings or a quiet retreat. Next to Gateway Mall and within a short distance of trains and buses, this home offers both convenience and comfort. ID#25-003",,
30757172,https://www.zillow.com/homedetails/1674-E-38th-St-Brooklyn-NY-11234/30757172_zpid/,815000,USD,FOR_SALE,RE/MAX Edge,3,2,1674 E 38th St,Brooklyn,NY,1674 E 38th St,11234,40.615726,-73.93588,https://photos.zillowstatic.com/fp/5a23f3d6734b1d0720b9c33083beb4e3-p_h.jpg,"https://photos.zillowstatic.com/fp/5a23f3d6734b1d0720b9c33083beb4e3-uncropped_scaled_within_1536_1152.jpg, https://photos.zillowstatic.com/fp/9c6ad6ab4491cfc36a26d54ead005d33-uncropped_scaled_within_1536_1152.jpg, https://photos.zillowstatic.com/fp/d9c6190a998e9c978e1442d4e1be3e6f-uncropped_scaled_within_1536_1152.jpg, https://photos.zillowstatic.com/fp/2e797d68b4eef781378355b5048b2191-uncropped_scaled_within_1536_1152.jpg, https://photos.zillowstatic.com/fp/5718a6f0bd1a41e6729d855c5538f137-uncropped_scaled_within_1536_1152.jpg, https://photos.zillowstatic.com/fp/80a25d6e6fd46bf70740184083a38f72-uncropped_scaled_within_1536_1152.jpg, https://photos.zillowstatic.com/fp/62ded5bf517b078827496be1c38be830-uncropped_scaled_within_1536_1152.jpg, https://photos.zillowstatic.com/fp/4956af5f0afcce8b8037efd79645ecf3-uncropped_scaled_within_1536_1152.jpg, https://photos.zillowstatic.com/fp/e1295655a83296c012d4680979c5d5a3-uncropped_scaled_within_1536_1152.jpg, https://photos.zillowstatic.com/fp/c9d1ad987599f53ac84d93c090158df2-uncropped_scaled_within_1536_1152.jpg, https://photos.zillowstatic.com/fp/83abf7850ad69cac234e8bfaa2695362-uncropped_scaled_within_1536_1152.jpg, https://photos.zillowstatic.com/fp/4ceda75ac4b6ff3563707ddb7f2119dc-uncropped_scaled_within_1536_1152.jpg, https://photos.zillowstatic.com/fp/63815028efed842afea15c6351e8e5a6-uncropped_scaled_within_1536_1152.jpg, https://photos.zillowstatic.com/fp/19423122f7a6e4accc800022265185d9-uncropped_scaled_within_1536_1152.jpg, https://photos.zillowstatic.com/fp/5bd1749c7fbec9df56abf022bd4fda7a-uncropped_scaled_within_1536_1152.jpg, https://photos.zillowstatic.com/fp/5097d7fb4dd18feeff1674db7c7cb17a-uncropped_scaled_within_1536_1152.jpg, https://photos.zillowstatic.com/fp/4c762203983459b7388cf2dc2879f0e4-uncropped_scaled_within_1536_1152.jpg, https://photos.zillowstatic.com/fp/2d049412e3473c3c673aa84c763a873c-uncropped_scaled_within_1536_1152.jpg, https://photos.zillowstatic.com/fp/9b9e9510662d1e5afee9ba3ed4738782-uncropped_scaled_within_1536_1152.jpg, https://photos.zillowstatic.com/fp/74964b23bd1ac30e210d371638635abf-uncropped_scaled_within_1536_1152.jpg, https://photos.zillowstatic.com/fp/280d9b0cf38b5994cf8eaf83ad1a8562-uncropped_scaled_within_1536_1152.jpg, https://photos.zillowstatic.com/fp/3b699e89e208fbcec8c1c37a34b7c64f-uncropped_scaled_within_1536_1152.jpg, https://photos.zillowstatic.com/fp/e7d2e18032154ceee544a9e9176ceb96-uncropped_scaled_within_1536_1152.jpg, https://photos.zillowstatic.com/fp/bf50836f380c76866d26d5f3c00f9492-uncropped_scaled_within_1536_1152.jpg, https://photos.zillowstatic.com/fp/cc76d7e3d364a731351c41138a7f3d70-uncropped_scaled_within_1536_1152.jpg, https://photos.zillowstatic.com/fp/da9f94bf3559c02124d6962eec1b1d46-uncropped_scaled_within_1536_1152.jpg, https://photos.zillowstatic.com/fp/03b08d789219f4ef011200e0a6c8da8d-uncropped_scaled_within_1536_1152.jpg, https://photos.zillowstatic.com/fp/cc4c6af0e19082d1b2c2cd670e901eb8-uncropped_scaled_within_1536_1152.jpg, https://photos.zillowstatic.com/fp/12953382fecb6a1117d5cfc5fdb014a9-uncropped_scaled_within_1536_1152.jpg, https://photos.zillowstatic.com/fp/80320f0b187df40254c2c51ab1be2d04-uncropped_scaled_within_1536_1152.jpg, https://photos.zillowstatic.com/fp/209919314c71c942a12fec1e14f51717-uncropped_scaled_within_1536_1152.jpg, https://photos.zillowstatic.com/fp/412ff652dce42f4648de524568f46cf7-uncropped_scaled_within_1536_1152.jpg, https://photos.zillowstatic.com/fp/ab158a21919ed7dc3f13720d2d58ac8e-uncropped_scaled_within_1536_1152.jpg, https://photos.zillowstatic.com/fp/55fc6b5e812789089e220956407ff8d1-uncropped_scaled_within_1536_1152.jpg, https://photos.zillowstatic.com/fp/abbce90478dcb05db1f5b7a5659004ff-uncropped_scaled_within_1536_1152.jpg",809400,3747,,,20,077100074,718-612-3088,Mei Hua (Michelle) Dong,929-688-0882,,,SINGLE_FAMILY,1925,1064,2200,Square Feet,"Welcome to this charming semi-attached single-family home located in the heart of Marine Park! Featuring a private driveway that fits multiple vehicles, this property offers the convenience and comfort every homeowner desires. The first floor boasts a bright and airy living room, a spacious eat-in kitchen equipped with all essential appliances, and a convenient half bathroom. The first floor also has tile floors throughout with heated floors, providing both style and year-round comfort. Upper level, the second floor offers three generously sized bedrooms and a full bathroom, perfect for comfortable family living. The full finished basement adds valuable versatility ideal as a recreation room, game room. Come outside into your private backyard oasis—a rare gem in the neighborhood! Enjoy summer days in your own swimming pool, host unforgettable BBQs, and entertain guests with ease in the expansive outdoor space designed for family gatherings, celebrations, and relaxation. Ideally situated just moments from Marine Park, Kings Plaza, and all the vibrant shopping and dining options along Flatbush Avenue, the location is unbeatable. This home is a true Marine Park treasure. Convenient Transportation: This home is well-connected by public transportation. Multiple MTA bus lines, including the B2, B3, B9, B31, B41, Q35, and more, are within a short distance—providing easy access to nearby subway stations and other parts of Brooklyn. The B41 bus runs directly along Flatbush Avenue and connects you to the 2 & 5 subway lines at Brooklyn College/Flatbush Avenue station, offering a straightforward commute to Manhattan and downtown Brooklyn. Drivers will also appreciate easy access to the Belt Parkway and other major roadways.—Don’t miss your opportunity to own it!!!",,
30762928,https://www.zillow.com/homedetails/2037-Schenectady-Ave-Brooklyn-NY-11234/30762928_zpid/,725000,USD,FOR_SALE,ProBase Real Estate,3,2,2037 Schenectady Ave,Brooklyn,NY,2037 Schenectady Ave,11234,40.62227,-73.9299,https://photos.zillowstatic.com/fp/399b753f2ac9e8734a083f48aa175711-p_h.jpg,"https://photos.zillowstatic.com/fp/399b753f2ac9e8734a083f48aa175711-uncropped_scaled_within_1536_1152.jpg, https://photos.zillowstatic.com/fp/b329b7985a41166335d27179f32b04a8-uncropped_scaled_within_1536_1152.jpg, https://photos.zillowstatic.com/fp/41fcb918b2938d2deae6cb1c3735d866-uncropped_scaled_within_1536_1152.jpg, https://photos.zillowstatic.com/fp/afe12d6a8fbc69c0e3feb2577374975d-uncropped_scaled_within_1536_1152.jpg, https://photos.zillowstatic.com/fp/392904a563bb0fd6ddc1d8968e615c14-uncropped_scaled_within_1536_1152.jpg, https://photos.zillowstatic.com/fp/85fbac3829a4639918931e7e38d4212a-uncropped_scaled_within_1536_1152.jpg, https://photos.zillowstatic.com/fp/e8e04990eff1c3fc9710dd89caafa253-uncropped_scaled_within_1536_1152.jpg, https://photos.zillowstatic.com/fp/3d1633448ed626c0bb99655e5c46aca5-uncropped_scaled_within_1536_1152.jpg, https://photos.zillowstatic.com/fp/eee741f025cfcd36cc61b45d304ec905-uncropped_scaled_within_1536_1152.jpg, https://photos.zillowstatic.com/fp/6d7fa8da5a4671088ca3ac07b30b893e-uncropped_scaled_within_1536_1152.jpg, https://photos.zillowstatic.com/fp/88c6b971b0f18f6a5b7dcdf3addbe323-uncropped_scaled_within_1536_1152.jpg, https://photos.zillowstatic.com/fp/4e9085595f2c3f911d1f2afc68171da8-uncropped_scaled_within_1536_1152.jpg, https://photos.zillowstatic.com/fp/851647bd087c128e7b49abfaa70d17ff-uncropped_scaled_within_1536_1152.jpg, https://photos.zillowstatic.com/fp/824b42413ba0ec20b70b54f8358757ba-uncropped_scaled_within_1536_1152.jpg, https://photos.zillowstatic.com/fp/aecccf269f2f7864750213c5fa987567-uncropped_scaled_within_1536_1152.jpg, https://photos.zillowstatic.com/fp/4fa7b294e37b4064a5113a1d490122b9-uncropped_scaled_within_1536_1152.jpg, https://photos.zillowstatic.com/fp/f4b9aadbeefea4aa77b51275cb4588d3-uncropped_scaled_within_1536_1152.jpg, https://photos.zillowstatic.com/fp/070819cedc6ff238ebcd36ad6ff528c7-uncropped_scaled_within_1536_1152.jpg, https://photos.zillowstatic.com/fp/03c01b7551e696e3ffa31ac9e318111d-uncropped_scaled_within_1536_1152.jpg, https://photos.zillowstatic.com/fp/742a9c9129276a88c57c6f53e2e2ddc9-uncropped_scaled_within_1536_1152.jpg, https://photos.zillowstatic.com/fp/c454a617bfa17209b5e0d4b8af92d635-uncropped_scaled_within_1536_1152.jpg, https://photos.zillowstatic.com/fp/9cb10bbd9be6d568a45e416e5a010822-uncropped_scaled_within_1536_1152.jpg, https://photos.zillowstatic.com/fp/09fcd1c068cee57f8385058f1fb45254-uncropped_scaled_within_1536_1152.jpg, https://photos.zillowstatic.com/fp/21983e048e7514476fbaa252d1694c8a-uncropped_scaled_within_1536_1152.jpg, https://photos.zillowstatic.com/fp/4d86d750d38014a588528e61cd14b9b3-uncropped_scaled_within_1536_1152.jpg",723800,3636,,,20,078450023,718-210-2727,JiaJie Zheng,718-314-3437,,,SINGLE_FAMILY,1920,1200,2178,Square Feet,"Detached single family property located in Flatlands. 15 x 36 building on 22 x 100 lot. Shared driveway. Hardwood floors. 3 bedroom, one and a half bathrooms, a full finished basements. Closed to schools, shopping and public transit.",,
