id,url,price,currency,status,brokerName,beds,baths,fullAddress,city,state,street,zipcode,latitude,longitude,image,photos,zestimate,rentZestimate,trueStatus,contingentListingType,daysOnZillow,parcelNumber,brokerPhoneNumber,agentName,agentPhoneNumber,agentEmail,agentOtherEmails,homeType,yearBuilt,area,lotArea,lotAreaUnits,description,schools,priceHistory
30724696,https://www.zillow.com/homedetails/1067-E-15th-St-Brooklyn-NY-11230/30724696_zpid/,850000,USD,FOR_SALE,Double Door Realty Inc,5,3,1067 E 15th St,Brooklyn,NY,1067 E 15th St,11230,40.623554,-73.96084,https://photos.zillowstatic.com/fp/8dc5cfb02ffafc4f68ef03c5b6cf96a1-p_h.jpg,"https://photos.zillowstatic.com/fp/8dc5cfb02ffafc4f68ef03c5b6cf96a1-uncropped_scaled_within_1536_1152.jpg, https://photos.zillowstatic.com/fp/88eb7413b4176955360355277071594e-uncropped_scaled_within_1536_1152.jpg, https://photos.zillowstatic.com/fp/d9f8b9beec93ab2d9d42a7a08637f3c5-uncropped_scaled_within_1536_1152.jpg, https://photos.zillowstatic.com/fp/3e08987d008daca7d7287c68fc1a9d06-uncropped_scaled_within_1536_1152.jpg, https://photos.zillowstatic.com/fp/6f3869bd103d83b0efffc3bbc3965c31-uncropped_scaled_within_1536_1152.jpg, https://photos.zillowstatic.com/fp/956dc1e2fe832aedf9e0018a57994ecb-uncropped_scaled_within_1536_1152.jpg, https://photos.zillowstatic.com/fp/4cabccd8c36147d3f74097647b6af583-uncropped_scaled_within_1536_1152.jpg, https://photos.zillowstatic.com/fp/8f0580c6a6bf0c55a580f0fff007b322-uncropped_scaled_within_1536_1152.jpg, https://photos.zillowstatic.com/fp/fb936bfd83b9305ad83dce5c70fcc03d-uncropped_scaled_within_1536_1152.jpg, https://photos.zillowstatic.com/fp/a48e381cd71599b7829898b044586c44-uncropped_scaled_within_1536_1152.jpg, https://photos.zillowstatic.com/fp/20ea529fcd1ebdb07eb8bf503d0470f3-uncropped_scaled_within_1536_1152.jpg, https://photos.zillowstatic.com/fp/b5a3237c9628b004a9441dba3290dfd0-uncropped_scaled_within_1536_1152.jpg, https://photos.zillowstatic.com/fp/04f4201ad4e2d0744356d3dcb573bf34-uncropped_scaled_within_1536_1152.jpg, https://photos.zillowstatic.com/fp/1e4188b654e2aaf572717c7bd29468bc-uncropped_scaled_within_1536_1152.jpg, https://photos.zillowstatic.com/fp/e0b644fc905aff162ca8348fb7d13090-uncropped_scaled_within_1536_1152.jpg, https://photos.zillowstatic.com/fp/4b13c10fc698a4f2d474c0ca4ca62daf-uncropped_scaled_within_1536_1152.jpg",832800,4439,,,35,067170061,917-589-1991,Cheryl  Samouha,917-589-1991,,,SINGLE_FAMILY,1915,1308,1200,Square Feet,"Welcome to the best entry point into Midwood. An extremely rare opportunity to own a home at a price that’s nearly impossible to find in this highly desirable neighborhood.    This move in ready home offers tremendous potential — both inside and out. The property comes with built-in upside: both neighboring houses — identical in layout — have extended in the front and added a second-story rear extension. The same opportunity exists here for the next owner with vision.  Move in, update, expand — or all three. Whatever your plans, the canvas is already in place. This is a smart buy in one of Brooklyn’s most established and desirable neighborhoods.    Steps from shopping, schools, houses of worship, and the Q train, this home has value, location, and long-term upside — all in one solid package.    Reach out now for more info!",,
454686773,https://www.zillow.com/homedetails/1448-E-53rd-St-1-Brooklyn-NY-11234/454686773_zpid/,745000,USD,FOR_SALE,Bergen Basin Real Estate,3,2,1448 E 53rd St #1,Brooklyn,NY,1448 E 53rd St #1,11234,40.623188,-73.92473,https://photos.zillowstatic.com/fp/8566bd6da0c215c71e8d31d7d85fee4e-p_h.jpg,"https://photos.zillowstatic.com/fp/8566bd6da0c215c71e8d31d7d85fee4e-uncropped_scaled_within_1536_1152.jpg, https://photos.zillowstatic.com/fp/75ac2f15c6dd68921e6348613777cac4-uncropped_scaled_within_1536_1152.jpg, https://photos.zillowstatic.com/fp/e253f3ee7785ac562ad712eab4a9a903-uncropped_scaled_within_1536_1152.jpg, https://photos.zillowstatic.com/fp/bc0d9fcd1e4e70d3a7ace0f735548337-uncropped_scaled_within_1536_1152.jpg, https://photos.zillowstatic.com/fp/4e21949057ef3b65e4358bab4c5536e2-uncropped_scaled_within_1536_1152.jpg, https://photos.zillowstatic.com/fp/d8f3321c10250a70205f14c05c55c7e8-uncropped_scaled_within_1536_1152.jpg, https://photos.zillowstatic.com/fp/d74338e4e19d2045f9a403ffaaa4da04-uncropped_scaled_within_1536_1152.jpg, https://photos.zillowstatic.com/fp/8014964620f3a0cbbece12d70b650155-uncropped_scaled_within_1536_1152.jpg, https://photos.zillowstatic.com/fp/a22e6d52611174e2eb8f98afeb29ed95-uncropped_scaled_within_1536_1152.jpg, https://photos.zillowstatic.com/fp/67a58c04c9a90f130231e2b9f574264d-uncropped_scaled_within_1536_1152.jpg, https://photos.zillowstatic.com/fp/9cb5dc888d5237db41b74959d116f8a8-uncropped_scaled_within_1536_1152.jpg, https://photos.zillowstatic.com/fp/19f59747074eb618bd037556d8eb30c1-uncropped_scaled_within_1536_1152.jpg, https://photos.zillowstatic.com/fp/bb229d60e455556aff35332f5ceb8b86-uncropped_scaled_within_1536_1152.jpg, https://photos.zillowstatic.com/fp/195aa8cd47727986118198b86261e8ea-uncropped_scaled_within_1536_1152.jpg, https://photos.zillowstatic.com/fp/b5e4009a899804203d4b5ef4bd2a1720-uncropped_scaled_within_1536_1152.jpg, https://photos.zillowstatic.com/fp/2d1fdb115090b70b0474e30e496db3a1-uncropped_scaled_within_1536_1152.jpg, https://photos.zillowstatic.com/fp/e63e67a4935898100c4d239faae8fdee-uncropped_scaled_within_1536_1152.jpg, https://photos.zillowstatic.com/fp/792a140f8d93250f9df8f60cca11255c-uncropped_scaled_within_1536_1152.jpg, https://photos.zillowstatic.com/fp/3bb82ddb39af05029f62658ac481d7c5-uncropped_scaled_within_1536_1152.jpg, https://photos.zillowstatic.com/fp/7ff2555a2c046c2fb3ac1a3a1314eeb3-uncropped_scaled_within_1536_1152.jpg, https://photos.zillowstatic.com/fp/11d1c7b5fc5b9db6136903670d35744d-uncropped_scaled_within_1536_1152.jpg",,,Active,,36,,718-763-4110,Bergen Basin,718-763-4110,,,SINGLE_FAMILY,1925,952,,sqft,"One Family Home Semi-Detached Move in Condition in Old Mill Basin. The home features 3 bedrooms, 1 3/4 bath and a full finished basement. Open concept living room and dining room, central air and heat, ceiling fans, kitchen (breakfast nook, granite counters, cherrywood cabinets and stainless steel appliances) with a door that leads to a nice back porch, hardwood/ tiled floors throughout the house, 1 full bath with a jacuzzi tub on the second floor, 3/4 bathroom in basement and has a backyard. Close to public transportation, shopping, schools, house of worships, playgrounds, and recreational areas. Owner is willing to hear all good offers. Come see for yourself before this home is sold!! Schedule a viewing today and make this house your home! This home will not last!",,
30789355,https://www.zillow.com/homedetails/29-Brighton-8-Pl-Brooklyn-NY-11235/30789355_zpid/,845000,USD,FOR_SALE,Homes R Beautiful Inc,5,3,29 Brighton 8 Pl,Brooklyn,NY,29 Brighton 8 Pl,11235,40.58097,-73.96029,https://photos.zillowstatic.com/fp/795048abb57d45e0ec6e332932e71112-p_h.jpg,"https://photos.zillowstatic.com/fp/795048abb57d45e0ec6e332932e71112-uncropped_scaled_within_1536_1152.jpg, https://photos.zillowstatic.com/fp/fb87d0baec495cce031164ebc03f0018-uncropped_scaled_within_1536_1152.jpg",,5367,Active,,37,086680835,718-753-5387,Ellen Charkey,718-753-5387,,,SINGLE_FAMILY,1930,1200,,sqft,"This completely detached home is located on a cul-de-sac affording both privacy and safety for children. There are 3 levels plus a finished basement. Each level has separate access presenting  many possibilities for an extended family or investment. The gas boiler with separate hot water tank and roof are recent. Owner anxious to sell. Co-brokers are welcome.        
PRICE REDUCED TO $845,000- SELLER IS MOTIVATED.",,
446338210,https://www.zillow.com/homedetails/66-Paerdegat-1st-St-Brooklyn-NY-11236/446338210_zpid/,685000,USD,FOR_SALE,Keller Williams Legendary,4,4,66 Paerdegat 1st Street,Brooklyn,NY,66 Paerdegat 1st Street,11236,40.633247,-73.9118,https://photos.zillowstatic.com/fp/bf4a1099b4bce74e2d0157379b0a65d5-p_h.jpg,https://photos.zillowstatic.com/fp/bf4a1099b4bce74e2d0157379b0a65d5-uncropped_scaled_within_1536_1152.jpg,,,,,39,080290026,516-328-8600,Janay D. Malloy SFR,,re@janaymalloy.com,,SINGLE_FAMILY,1970,1440,2600,Square Feet,"Charming & Spacious Home in Sought-After Paerdegat/Canarsie Area!

Welcome to your dream home nestled in the highly desirable Paerdegat/Canarsie area of Brooklyn! Situated on a picturesque, tree-lined street, this property offers an exceptional blend of comfort, convenience, and potential. With a little TLC, this home could truly shine and become the perfect space for its future owners.

Key Features:
4 Bedrooms, 4 Bathrooms: Including a large primary suite ensuite full bathroom.
Expansive Living Spaces: Enjoy a full living room, dining room, and a large eat-in kitchen—perfect for entertaining and family gatherings.
Three Levels of Living: Includes a fully finished basement with its own bathroom and a separate outside entrance, ideal for guests or additional recreational space.
Outdoor Amenities: A rear balcony off the first floor provides the perfect spot for relaxation or outdoor dining.
Parking Convenience: Private driveway with an attached garage ensures easy parking.
Prime Location:
Residential Tranquility: Set on a quiet, tree-lined street with a friendly neighborhood vibe.
Excellent Accessibility: Close to transportation options, shopping, and dining.
Commuter-Friendly: Conveniently near the Belt Parkway for easy travel.
This property is a rare gem, offering a spacious layout, unbeatable proximity to everything you need, and the opportunity to add your personal touch. With a little work, you can transform this house into the home of your dreams.

Don’t miss out",,
30794228,https://www.zillow.com/homedetails/102-Noel-Ave-Brooklyn-NY-11229/30794228_zpid/,788000,USD,FOR_SALE,Bergen Basin Realty LLC,2,2,102 Noel Ave,Brooklyn,NY,102 Noel Ave,11229,40.58891,-73.92452,https://photos.zillowstatic.com/fp/0ac3686b07259aafca6c6fb0a60c47e0-p_h.jpg,"https://photos.zillowstatic.com/fp/0ac3686b07259aafca6c6fb0a60c47e0-uncropped_scaled_within_1536_1152.jpg, https://photos.zillowstatic.com/fp/a2f8393fd3a73f2885fa96b0d7bfebca-uncropped_scaled_within_1536_1152.jpg, https://photos.zillowstatic.com/fp/8864fc625bd1cf8ed83225522a6663cd-uncropped_scaled_within_1536_1152.jpg, https://photos.zillowstatic.com/fp/2252dfdeb8ded89ebe801f46d6cf3b3e-uncropped_scaled_within_1536_1152.jpg, https://photos.zillowstatic.com/fp/5f24785891a067a263b0666d8adb6cc1-uncropped_scaled_within_1536_1152.jpg, https://photos.zillowstatic.com/fp/9bcb79cefb50e3412a25719cf63244c3-uncropped_scaled_within_1536_1152.jpg, https://photos.zillowstatic.com/fp/7990432487f39c67c990050dce65fba0-uncropped_scaled_within_1536_1152.jpg, https://photos.zillowstatic.com/fp/7218f61441c9a8e2b25a6686a18d76e9-uncropped_scaled_within_1536_1152.jpg, https://photos.zillowstatic.com/fp/51913970641b9174f7d0db5ae0067ebc-uncropped_scaled_within_1536_1152.jpg, https://photos.zillowstatic.com/fp/f53cfd47fed2d88681eb3e39bfed19b3-uncropped_scaled_within_1536_1152.jpg, https://photos.zillowstatic.com/fp/dc8de26de8049b8c4d52886ff1665c3c-uncropped_scaled_within_1536_1152.jpg, https://photos.zillowstatic.com/fp/e58673d3a8edd48f83a112648368fa0c-uncropped_scaled_within_1536_1152.jpg, https://photos.zillowstatic.com/fp/50cca14086007375121c3f0af5512822-uncropped_scaled_within_1536_1152.jpg, https://photos.zillowstatic.com/fp/d27ca33093dca161b1d68ba729ae057f-uncropped_scaled_within_1536_1152.jpg, https://photos.zillowstatic.com/fp/2c8505614b5b91b0917d11dd822343f2-uncropped_scaled_within_1536_1152.jpg, https://photos.zillowstatic.com/fp/4b795b362bb19dfcc3c5f6103faa5e90-uncropped_scaled_within_1536_1152.jpg, https://photos.zillowstatic.com/fp/a94fc4a8c903e22f08c1693d069dd923-uncropped_scaled_within_1536_1152.jpg, https://photos.zillowstatic.com/fp/dea119a75a9f6bd23becca5596c0fe84-uncropped_scaled_within_1536_1152.jpg, https://photos.zillowstatic.com/fp/84b7298f18b05f64a7f72d75d7a87d6c-uncropped_scaled_within_1536_1152.jpg, https://photos.zillowstatic.com/fp/0707d840a989c618bf4b659184a74f71-uncropped_scaled_within_1536_1152.jpg, https://photos.zillowstatic.com/fp/68c690fe51305b1bddb2af9db246c056-uncropped_scaled_within_1536_1152.jpg, https://photos.zillowstatic.com/fp/6fb3c01c75641db6b76a39403a1f6232-uncropped_scaled_within_1536_1152.jpg, https://photos.zillowstatic.com/fp/fd2ccdbbecf6617b1c035356bffc14cc-uncropped_scaled_within_1536_1152.jpg",769100,3560,,,41,089140548,718-763-4110,Christina Reizis,917-402-0280,,,SINGLE_FAMILY,1925,1255,1800,Square Feet,"Welcome to this Gerritsen Beach fully renovated beauty!! Newly raised two floor corner property with a brand new roof and brand new siding. Fully renovated smart home with radiant heat and ceramic tile floors on both floors. First floor features a huge kitchen, dining area, 1 bathroom, (1 bedroom removed to open up kitchen area and work space), laundry room which holds the boiler as well and a living room with cathedral ceilings. Kitchen is all new with appliances. Second floor Includes 2 bedrooms and 1 bathroom with a Mr. Steam shower. Master bedroom features 2 closets with one being a walk in. Second bedroom has 2 closets. Brand new ductless central air condition/ heating unit installed. House is raised and has 5 foot crawl space for storage.  Newly cemented exterior floors of the yard. Comes with a shed for storage and a gazebo for the yard. Freshly done landscaping on the side of the house with stone finishes. New bow window's have been installed on the first floor. House has the potential to add a 3rd bedroom on the first floor. This is a perfect move in condition home to call your own with plenty of parking space around.",,
30644060,https://www.zillow.com/homedetails/351-Autumn-Ave-Brooklyn-NY-11208/30644060_zpid/,699000,USD,FOR_SALE,Century 21 Monticello Realty,3,3,351 Autumn Avenue,Brooklyn,NY,351 Autumn Avenue,11208,40.681393,-73.86932,https://photos.zillowstatic.com/fp/517703cca21002c6cf5ab238bfac3552-p_h.jpg,"https://photos.zillowstatic.com/fp/517703cca21002c6cf5ab238bfac3552-uncropped_scaled_within_1536_1152.jpg, https://photos.zillowstatic.com/fp/c6086865ab5dc1902456f11609ab160a-uncropped_scaled_within_1536_1152.jpg, https://photos.zillowstatic.com/fp/fcbc8ce532f2ee4151206b70ed26d39f-uncropped_scaled_within_1536_1152.jpg, https://photos.zillowstatic.com/fp/1399503014600642787e83ff0c5c1519-uncropped_scaled_within_1536_1152.jpg, https://photos.zillowstatic.com/fp/50d12e9376556c9aeec3ec1181162711-uncropped_scaled_within_1536_1152.jpg, https://photos.zillowstatic.com/fp/66672f3d18a1685709e518e5ad894c65-uncropped_scaled_within_1536_1152.jpg, https://photos.zillowstatic.com/fp/eea096b32f72b3d1b67b3cff4d3c5283-uncropped_scaled_within_1536_1152.jpg, https://photos.zillowstatic.com/fp/efd0915a10f3a4eac7145b81676cbb52-uncropped_scaled_within_1536_1152.jpg, https://photos.zillowstatic.com/fp/a60c988bc4fd60fb93c4ec0c62b3bdc5-uncropped_scaled_within_1536_1152.jpg, https://photos.zillowstatic.com/fp/2932e0a59fb1bd4f957968a07e58bca8-uncropped_scaled_within_1536_1152.jpg, https://photos.zillowstatic.com/fp/be1faa04951f52df2ef746b45b434b6b-uncropped_scaled_within_1536_1152.jpg, https://photos.zillowstatic.com/fp/a9a67fc1d7fc290819c6411203932fe2-uncropped_scaled_within_1536_1152.jpg, https://photos.zillowstatic.com/fp/f9dd3fc994119864d0436435a3d859bd-uncropped_scaled_within_1536_1152.jpg, https://photos.zillowstatic.com/fp/47a106088cc1e27018510aab6d4f7ba9-uncropped_scaled_within_1536_1152.jpg, https://photos.zillowstatic.com/fp/791e693cfa901c45c7f48a828d03a67f-uncropped_scaled_within_1536_1152.jpg, https://photos.zillowstatic.com/fp/1a5d2a8f51e4ddf8df23cb6945029596-uncropped_scaled_within_1536_1152.jpg, https://photos.zillowstatic.com/fp/614b78ebd576c1eac9dcaaa401a17b7d-uncropped_scaled_within_1536_1152.jpg, https://photos.zillowstatic.com/fp/2b8236cfbcdbebc62cc78e34c1beb3aa-uncropped_scaled_within_1536_1152.jpg, https://photos.zillowstatic.com/fp/c07f0512c8b97563255938c9ca1705bc-uncropped_scaled_within_1536_1152.jpg, https://photos.zillowstatic.com/fp/8f5bfe0bf0ff5634a2976a29f6b876d9-uncropped_scaled_within_1536_1152.jpg, https://photos.zillowstatic.com/fp/de977976f6c24df92b1e542bf481746f-uncropped_scaled_within_1536_1152.jpg",,,,,42,041720021,718-804-5757,John Chetram,917-570-9532,john@monticelloreg.com,info@monticelloreg.com,SINGLE_FAMILY,1910,1102,1812,Square Feet,"Welcome to this charming one-family home in the heart of Cypress Hills, a neighborhood that borders Woodhaven and Ozone Park in Queens. This home features three bedrooms and three bathrooms, a finished basement with a bilco door, and a brick exterior. The home is conveniently located close to schools, shopping, and public transit, with easy access to the J and A lines to the city. The home has a lot size of 1,812 square feet and was built in 1910. This home is a great opportunity for anyone looking for a cozy and affordable place to call their own in Brooklyn. Don't miss this chance to see it for yourself!",,
30758504,https://www.zillow.com/homedetails/1065-E-39th-St-Brooklyn-NY-11210/30758504_zpid/,795000,USD,FOR_SALE,Compass,4,2,1065 E 39th St,Brooklyn,NY,1065 E 39th St,11210,40.630936,-73.9385,https://photos.zillowstatic.com/fp/33ae3f3715017c2c9e3f09a1e5fc7c96-p_h.jpg,"https://photos.zillowstatic.com/fp/33ae3f3715017c2c9e3f09a1e5fc7c96-uncropped_scaled_within_1536_1152.jpg, https://photos.zillowstatic.com/fp/5c7e5cf4c1f41088f9c04733910f2198-uncropped_scaled_within_1536_1152.jpg, https://photos.zillowstatic.com/fp/925cf20d624131c9a44ada4ad45bd527-uncropped_scaled_within_1536_1152.jpg, https://photos.zillowstatic.com/fp/5a268b6aac4e0779c4c8afe32945e0fc-uncropped_scaled_within_1536_1152.jpg, https://photos.zillowstatic.com/fp/84c21e5d691813b3f4aa4ecb47133cfb-uncropped_scaled_within_1536_1152.jpg, https://photos.zillowstatic.com/fp/7daea096127a5a1bbeb23c3da92af4a4-uncropped_scaled_within_1536_1152.jpg, https://photos.zillowstatic.com/fp/32a08d4f0ce602ab6d45e5757affe92b-uncropped_scaled_within_1536_1152.jpg, https://photos.zillowstatic.com/fp/3640cef24c8aba8de0d6f38526d74bbb-uncropped_scaled_within_1536_1152.jpg, https://photos.zillowstatic.com/fp/582b4db62d25e5f5cd65ecf2d3f9d009-uncropped_scaled_within_1536_1152.jpg, https://photos.zillowstatic.com/fp/70b1d91775f8748b8529d3137e4a70c3-uncropped_scaled_within_1536_1152.jpg, https://photos.zillowstatic.com/fp/d76fba5bb4b6f643d6826b4a80e1fbc3-uncropped_scaled_within_1536_1152.jpg, https://photos.zillowstatic.com/fp/bfd120b74e3d056053d4b30f5485c558-uncropped_scaled_within_1536_1152.jpg, https://photos.zillowstatic.com/fp/83c19bfe02622b139e87d32fd608e501-uncropped_scaled_within_1536_1152.jpg, https://photos.zillowstatic.com/fp/b8cdba51a6a3213667e74262fe0fd556-uncropped_scaled_within_1536_1152.jpg, https://photos.zillowstatic.com/fp/0b3a0f6d36af941e8c385b656cc8ea84-uncropped_scaled_within_1536_1152.jpg",792200,4510,Active,,42,077430023,518-859-3056,Kristen Jock,518-859-3056,kristen.jock@compass.com,"gene.keyser@compass.com, kashif.khan@compass.com, info@elikarealestate.com",SINGLE_FAMILY,1910,2145,,sqft,"Located on a quiet cul-de-sac just beside Amersfort Park, this semi-detached single-family home offers over 2,000 SF of space, light, and versatility that city dwellers crave—with the added bonus of a backyard and private parking.

Spanning four levels, the home features hardwood floors, high ceilings, and abundant storage throughout. The main level offers a comfortable flow between the living room, formal dining room, and eat-in kitchen, with a bright sunroom that adds charm and flexibility to the layout. Upstairs, three spacious bedrooms support rest and privacy, while the finished attic serves beautifully as a fourth bedroom, playroom, or creative space with additional storage.

The fully finished basement includes a full bathroom, kitchenette, and a separate entrance—ideal for recreation, a home gym, guest space, or other personal use.

Outdoors, enjoy a private backyard and a shared driveway with a detached garage. Convenient to nearby amenities along Flatbush Avenue and Kings Highway, Brooklyn College, and the 2/5 train lines, this is a welcoming home in a quiet, connected corner of East Flatbush.",,
30766500,https://www.zillow.com/homedetails/5517-Whitty-Ln-Brooklyn-NY-11203/30766500_zpid/,675000,USD,FOR_SALE,Shore Line Realty Group Corp,3,2,5517 Whitty Lane,Brooklyn,NY,5517 Whitty Lane,11203,40.6406,-73.92498,https://photos.zillowstatic.com/fp/93259454829c1cfa9a9edff214171e25-p_h.jpg,"https://photos.zillowstatic.com/fp/93259454829c1cfa9a9edff214171e25-uncropped_scaled_within_1536_1152.jpg, https://photos.zillowstatic.com/fp/031bccc31041edcf1b2417648199f330-uncropped_scaled_within_1536_1152.jpg, https://photos.zillowstatic.com/fp/217c6e479ff63eb4bb4bd43a466ad993-uncropped_scaled_within_1536_1152.jpg, https://photos.zillowstatic.com/fp/ca617821a7bfbbe277071cae7accfba6-uncropped_scaled_within_1536_1152.jpg, https://photos.zillowstatic.com/fp/3be1a744864d076741cc339d9f5d5d3e-uncropped_scaled_within_1536_1152.jpg, https://photos.zillowstatic.com/fp/617cd8a21edb6de9e2be470bab91f832-uncropped_scaled_within_1536_1152.jpg, https://photos.zillowstatic.com/fp/679bb835d87c455881240d9a14ee2a02-uncropped_scaled_within_1536_1152.jpg",,,,,45,079300123,516-650-5394,Binta Cherian,917-557-9355,,,SINGLE_FAMILY,1940,1710,1710,Square Feet,"This beautiful home is featured with 3 bedroom 2 and half baths. living room, dining room, attached car garage. must see.",,
30759915,https://www.zillow.com/homedetails/4584-Kings-Hwy-Brooklyn-NY-11234/30759915_zpid/,825000,USD,FOR_SALE,The Turner Realty Group Inc.,3,2,4584 Kings Hwy,Brooklyn,NY,4584 Kings Hwy,11234,40.62956,-73.93218,https://photos.zillowstatic.com/fp/10b3ca83e9e181fe8ce40c56135672a3-p_h.jpg,https://photos.zillowstatic.com/fp/10b3ca83e9e181fe8ce40c56135672a3-uncropped_scaled_within_1536_1152.jpg,827700,3687,Active,,45,077710155,917-362-9124,Cherry David,917-362-9124,,,SINGLE_FAMILY,1945,,,sqft,"Solid Brick 3 bedroom Duplex 
Full Basement with separate entrance. Parking garage and separate backyard. Quiet Treelined block. Shown by appointment",,
454111975,https://www.zillow.com/homedetails/2061-Coleman-St-1-Brooklyn-NY-11234/454111975_zpid/,849000,USD,FOR_SALE,Tracey Real Estate,3,2,2061 Coleman St #1,Brooklyn,NY,2061 Coleman St #1,11234,40.611065,-73.926254,https://photos.zillowstatic.com/fp/6f5c56865af09e690a9ff875ba2d2f54-p_h.jpg,"https://photos.zillowstatic.com/fp/6f5c56865af09e690a9ff875ba2d2f54-uncropped_scaled_within_1536_1152.jpg, https://photos.zillowstatic.com/fp/3df8684f9664903d108c17f33e0da12f-uncropped_scaled_within_1536_1152.jpg, https://photos.zillowstatic.com/fp/5544c7f13a1be258908ccc4c2fc041b2-uncropped_scaled_within_1536_1152.jpg, https://photos.zillowstatic.com/fp/d0836204fe80e2c2ebb4767788f4789b-uncropped_scaled_within_1536_1152.jpg, https://photos.zillowstatic.com/fp/94c32842fea2b87fc2081cc10ce90d6d-uncropped_scaled_within_1536_1152.jpg, https://photos.zillowstatic.com/fp/e8fa40d332e48d3313ca43aef3c17abe-uncropped_scaled_within_1536_1152.jpg, https://photos.zillowstatic.com/fp/fa9bd67d38e8f83ff0ec07834982f33e-uncropped_scaled_within_1536_1152.jpg, https://photos.zillowstatic.com/fp/bc373d6a278d63be439d558c0c1ed927-uncropped_scaled_within_1536_1152.jpg, https://photos.zillowstatic.com/fp/c343c0a8a64bd8e94383d3ca30ba1503-uncropped_scaled_within_1536_1152.jpg, https://photos.zillowstatic.com/fp/9f5273c7b078ae0af2b603972e1aada0-uncropped_scaled_within_1536_1152.jpg, https://photos.zillowstatic.com/fp/16a8f1d76eacd53cec79cc21d7229240-uncropped_scaled_within_1536_1152.jpg, https://photos.zillowstatic.com/fp/e1cf9bfef9c2b7833e68861d62a95702-uncropped_scaled_within_1536_1152.jpg, https://photos.zillowstatic.com/fp/8cb19922d829f44f7c2121180155d6e0-uncropped_scaled_within_1536_1152.jpg, https://photos.zillowstatic.com/fp/b3db473d0dc14b1b12453275d08a6d1f-uncropped_scaled_within_1536_1152.jpg, https://photos.zillowstatic.com/fp/1df7ef5ce25e16f7b19d0cb501d0f3c4-uncropped_scaled_within_1536_1152.jpg, https://photos.zillowstatic.com/fp/5c77562c50c49c9ef13f23650c275037-uncropped_scaled_within_1536_1152.jpg, https://photos.zillowstatic.com/fp/ba5aa5defb516e0c2917021e5f0eca3c-uncropped_scaled_within_1536_1152.jpg, https://photos.zillowstatic.com/fp/65d30c7905ce6e27b36aa761b5eb688e-uncropped_scaled_within_1536_1152.jpg, https://photos.zillowstatic.com/fp/a6238aad73e92219039093fcfc999bca-uncropped_scaled_within_1536_1152.jpg",,,Active,,45,,718-376-4994,Robert Tracey,718-376-4994,traceyre1@aol.com,,SINGLE_FAMILY,1930,1216,,sqft,"Marine Park! This detached 4 bedroom house (used as a 3 bedroom) is ready for its new owner. When entering the front entrance, there is a bright and airy 3 season enclosed porch. From the front porch you enter a large living room, formal dining room, then a full kitchen and hardwood floors throughout. The second floor has 3 spacious bedrooms, a full bath, washer and dryer. The basement is full and finished. There is also an additional 3/4 bath and lots of storage space. Completing this beautiful home is a rear deck and large rear yard. A Must See!!",,
